{
  "$schema": "http://json-schema.org/draft-07/schema#",
  "$id": "https://github.com/software-description-language/spec/layer_logic/operation.schema.json",
  "title": "SDL Operation",
  "description": "An Operation is the unit of work inside a service — a named piece of business logic that the service performs. It implements three DL concepts simultaneously: Unit (the actor), Flow (the ordered execution), and Perspective (multiple named views of the same logic). Every Operation has one required block: 'business' (the intent perspective in plain language — always the primary artifact). The 'routing' block (the implementation perspective in technical terms) is optional — populate it when engineers need to audit code decisions, omit it when AI handles code routing. Alias: sometimes called a BusinessUnit to emphasize that the business perspective is primary.",
  "type": "object",
  "dl": {
    "profile": "software",
    "version": "0.1",
    "concepts": ["Unit", "Flow", "Perspective"],
    "layer": "semantic",
    "layer_ref": "layer_logic",
    "perspectives": [
      {
        "name": "business",
        "role": "intent",
        "required": true,
        "description": "Describes the operation in plain language for domain experts. Business rules, preconditions, outcomes, and failure modes. Always required — this is the primary artifact."
      },
      {
        "name": "routing",
        "role": "implementation",
        "required": false,
        "description": "Describes the technical execution path for engineers: handler function, middleware chain, ordered steps, function calls, error handling. Optional — omit when AI handles code routing and engineers do not need to audit implementation decisions."
      }
    ],
    "notes": "Operation = Unit (performs work) + Flow (routing.steps[] is the ordered execution sequence) + Perspective (business{} is the mandatory intent view; routing{} is the optional implementation view). The business perspective is always the primary artifact at layer_logic."
  },
  "required": ["id", "label", "business"],
  "additionalProperties": false,
  "properties": {
    "id": {
      "type": "string",
      "description": "Unique kebab-case identifier for this operation within the service.",
      "pattern": "^[a-z0-9][a-z0-9-_]*[a-z0-9]$",
      "examples": ["create-order", "handle-payment-completed", "cancel-order"]
    },
    "label": {
      "type": "string",
      "description": "Human-readable name. Write as a verb phrase.",
      "examples": ["Create Order", "Handle Payment Completed", "Cancel Order"]
    },
    "description": {
      "type": "string",
      "description": "Optional one-paragraph summary of what this operation does and why it exists."
    },
    "business": {
      "type": "object",
      "description": "The intent perspective on this operation. Describes what the service does from a business or domain standpoint, in plain language. No implementation details. Audience: domain experts, product managers, senior engineers auditing AI-generated logic.",
      "required": ["summary", "rules"],
      "additionalProperties": false,
      "properties": {
        "summary": {
          "type": "string",
          "description": "One or two sentences: what business goal does this operation accomplish?",
          "examples": [
            "Accepts a customer's order request, validates it against business rules, and initiates the payment and fulfilment process.",
            "Transitions an order to CONFIRMED status once payment has been verified."
          ]
        },
        "rules": {
          "type": "array",
          "description": "The business rules and domain decisions that govern this operation. Write each rule as a plain-language statement that a domain expert would articulate. These are what engineers need to understand and audit.",
          "minItems": 1,
          "items": { "type": "string" },
          "examples": [[
            "An order cannot be created if any line item is out of stock.",
            "Orders over $10,000 are automatically flagged for manual review before confirmation.",
            "A customer may not place more than 5 orders within any 24-hour window.",
            "The cart must contain at least one item with a positive quantity."
          ]]
        },
        "preconditions": {
          "type": "array",
          "description": "What must be true before this operation can run — actor state, data requirements, authentication.",
          "items": { "type": "string" },
          "examples": [["User must be authenticated", "Cart must be non-empty", "Shipping address must be provided"]]
        },
        "outcomes": {
          "type": "array",
          "description": "Observable state changes after this operation succeeds. Written in plain language — not HTTP codes, not technical side effects.",
          "items": { "type": "string" },
          "examples": [["Order is persisted with AWAITING_PAYMENT status", "Customer receives an order confirmation number", "Inventory reservation is initiated asynchronously"]]
        },
        "failure_modes": {
          "type": "array",
          "description": "Meaningful failure cases from a business perspective — what goes wrong for the user or domain, and how the system responds.",
          "items": {
            "type": "object",
            "required": ["condition", "response"],
            "additionalProperties": false,
            "properties": {
              "condition": {
                "type": "string",
                "examples": ["Item is out of stock", "Customer has exceeded the 5-orders-per-24h limit"]
              },
              "response": {
                "type": "string",
                "examples": ["Order is rejected; customer is shown which items are unavailable", "Order is rejected; customer is told when they can next place an order"]
              }
            }
          }
        },
        "domain_events_emitted": {
          "type": "array",
          "description": "Domain events produced by this operation on success. Written in past-tense verb.noun event notation.",
          "items": { "type": "string" },
          "examples": [["order.created", "order.confirmed", "order.cancelled"]]
        }
      }
    },
    "routing": {
      "type": "object",
      "description": "The implementation perspective on this operation. Describes the technical execution path: the entry handler, middleware chain, the ordered sequence of function calls and decisions, and error handling. Audience: engineers reading or implementing the code. Optional — omit when AI handles code generation.",
      "required": ["handler"],
      "additionalProperties": false,
      "properties": {
        "handler": {
          "type": "string",
          "description": "The name of the primary handler function or method. Use the actual name from the codebase.",
          "examples": ["OrderController.createOrder", "createOrderHandler", "OrderService.create"]
        },
        "file_ref": {
          "type": "string",
          "description": "Path to the file containing the handler, relative to the repo root.",
          "examples": ["src/controllers/order.controller.ts", "internal/order/handler.go"]
        },
        "middleware_chain": {
          "type": "array",
          "description": "Ordered list of middleware, guards, and interceptors applied before the handler runs.",
          "items": {
            "type": "object",
            "required": ["name"],
            "additionalProperties": false,
            "properties": {
              "name":       { "type": "string", "examples": ["authenticate", "validateOrderBody", "rateLimitByUser"] },
              "purpose":    { "type": "string", "description": "What this middleware does in plain language." },
              "file_ref":   { "type": "string" },
              "on_failure": { "type": "string", "examples": ["Return 401 Unauthorized", "Return 429 Too Many Requests"] }
            }
          }
        },
        "steps": {
          "type": "array",
          "description": "The ordered sequence of function calls, service calls, and decisions inside the handler. Use hierarchical step ids: '1.0', '2.0' for sequential; '2.a', '2.b' for parallel at the same level.",
          "items": {
            "type": "object",
            "required": ["id", "action"],
            "additionalProperties": false,
            "properties": {
              "id":             { "type": "string", "examples": ["1.0", "2.a", "2.b", "3.0"] },
              "action":         { "type": "string", "description": "What this step does. Write as a code-level verb phrase." },
              "calls":          { "type": "string", "description": "The actual function, method, or dependency being invoked." },
              "dependency_ref": { "type": "string", "description": "If this step calls an external dependency, the id of the Dependency primitive." },
              "parallel":       { "type": "boolean", "default": false },
              "condition":      { "type": "string", "examples": ["if (order.total > 10000)"] },
              "returns":        { "type": "string", "examples": ["ValidatedOrder", "StockAvailabilityMap"] },
              "error": {
                "type": "object",
                "additionalProperties": false,
                "properties": {
                  "throws":   { "type": "string" },
                  "handling": { "type": "string" }
                }
              },
              "notes": { "type": "string" }
            }
          }
        },
        "transaction": {
          "type": "object",
          "additionalProperties": false,
          "properties": {
            "kind":  { "type": "string", "enum": ["database", "saga", "outbox", "none"] },
            "scope": { "type": "string" }
          }
        },
        "idempotency": {
          "type": "object",
          "additionalProperties": false,
          "properties": {
            "strategy": { "type": "string", "enum": ["none", "deduplication-key", "database-unique-constraint", "check-then-insert", "custom"] },
            "key":      { "type": "string" }
          }
        }
      }
    },
    "input_shape_ref": {
      "type": "string",
      "description": "The id of the DataShape representing the validated input to this operation.",
      "examples": ["create-order-request", "payment-completed-event"]
    },
    "output_shape_ref": {
      "type": "string",
      "description": "The id of the DataShape representing what this operation returns on success.",
      "examples": ["create-order-response", "order-record"]
    },
    "tags": {
      "type": "array",
      "items": { "type": "string" },
      "examples": [["critical-path", "writes", "emits-events", "idempotent"]]
    },
    "meta": {
      "type": "object",
      "additionalProperties": true
    }
  }
}
